{"canonical_json_profile":"pcs-jcs-rfc8785-v1","claim":{"assumptions":["A1"],"id":"C1","kind":"computational","predicate_commitment":"pcs-predicate-sha256-v2:41cca8b472be635d5e56b4ca09adee5868438c4977ac4cf42b239c8ca2822db7","required_evidence":["E1"]},"context":[{"id":"A1","statement":"fixture assumption"}],"decision":"COMPUTATIONALLY_SUPPORTED","evidence":[{"id":"E1","kind":"computational_test","outcome":"PASS","predicate_commitment":"pcs-predicate-sha256-v2:41cca8b472be635d5e56b4ca09adee5868438c4977ac4cf42b239c8ca2822db7"}],"predicate_hash_format":"pcs-predicate-sha256-v2","source":{"certificate_integrity_hash":"0274271466110e9ac5af500dcb5682880a89c4d3529f63b8141eb5b17e272509","certificate_semantic_hash":"f3471c37a7cb90caec88909f3a69de7285b2b74011ac8260741da1bb473d5998","checker_version":"pcs-python-kernel/0.6.0-dev","claim_id":"C1","spec_version":"pcs-0.6"},"wire_format":"pcs-normalized-decision-v2","wire_hash_format":"pcs-normalized-decision-sha256-v2","wire_semantic_hash":"e7fe1b888698f8a06eba17e3f7d6d70142e08e2be2deb580e20c24411b3cd6a5"}